{"$schema":"https://json-schema.org/draft/2020-12/schema","$id":"https://rot.dev/schemas/survival-project-state.v2.schema.json","title":"SurvivalProjectStateV2","type":"object","additionalProperties":false,"required":["schema_version","project_id","north_star","current_objective_id","observed_source_sha","event_watermark","authority_state","active_workstreams","active_claims","blockers","verified_capabilities","unverified_capabilities","next_safe_actions"],"properties":{"schema_version":{"const":"2"},"project_id":{"type":"string","minLength":1,"maxLength":256},"north_star":{"type":"string","minLength":1,"maxLength":4096},"current_objective_id":{"type":"string","minLength":1,"maxLength":256},"observed_source_sha":{"description":"Upstream semantic authority revision projected into this state; not the commit that contains this projection artifact.","type":"string","pattern":"^[0-9a-f]{40}$"},"event_watermark":{"type":"integer","minimum":0},"authority_state":{"enum":["PROPOSED","IMPLEMENTED","EXECUTED","VERIFIED","EMPIRICALLY_QUALIFIED","BLOCKED","DEGRADED_EXTERNAL","SUPERSEDED"]},"active_workstreams":{"type":"array","items":{"type":"string","maxLength":256},"maxItems":256,"uniqueItems":true},"active_claims":{"type":"array","items":{"type":"string","maxLength":256},"maxItems":512,"uniqueItems":true},"blockers":{"type":"array","items":{"type":"string","maxLength":1024},"maxItems":256},"verified_capabilities":{"type":"array","items":{"type":"string","maxLength":256},"maxItems":512,"uniqueItems":true},"unverified_capabilities":{"type":"array","items":{"type":"string","maxLength":256},"maxItems":512,"uniqueItems":true},"decisions":{"type":"array","items":{"type":"string","maxLength":256},"maxItems":512,"uniqueItems":true},"latest_checkpoint_id":{"type":["string","null"],"maxLength":256},"projection_hash":{"type":["string","null"],"pattern":"^sha256:[0-9a-f]{64}$"},"next_safe_actions":{"type":"array","minItems":1,"maxItems":32,"items":{"type":"string","maxLength":1024}}}}