{"active_claims":["rot://claim/agentic-os/survival-v2-contract-surface"],"active_workstreams":["rot://workstream/agentic-os/graph-refactor-v2-survival"],"authority_state":"IMPLEMENTED","blockers":["rot://blocker/agentic-os/cp01-cp03-governance-not-promotion-qualified","rot://blocker/agentic-os/death-drill-not-empirically-executed","rot://blocker/agentic-os/durable-event-authority-not-qualified","rot://blocker/agentic-os/github-promotion-enforcement-not-active","rot://blocker/agentic-os/signed-head-enforcement-not-active"],"current_objective_id":"rot://objective/agentic-os/survival-v2-cp16-post-integration-continuity-reconciliation","decisions":["rot://decision/agentic-os/consumed-transitions-never-remain-next-safe-action","rot://decision/agentic-os/empirical-death-drill-requires-independent-fresh-successor-evidence","rot://decision/agentic-os/exact-governance-locator-resolution-does-not-equal-promotion","rot://decision/agentic-os/github-native-pr-merge-path-can-produce-verified-commit","rot://decision/agentic-os/latest-checkpoint-seals-pre-pointer-advance-state","rot://decision/agentic-os/latest-path-strict-legacy-lineage-id-indexed","rot://decision/agentic-os/observed-source-sha-not-self-head","rot://decision/agentic-os/operator-cli-mutations-remain-fail-closed","rot://decision/agentic-os/pr2-superceded-after-semantic-audit","rot://decision/agentic-os/projections-never-authority","rot://decision/agentic-os/promotion-readiness-observer-never-grants-authority","rot://decision/agentic-os/promotion-ready-requires-external-enforcement-and-signed-head","rot://decision/agentic-os/reference-verification-does-not-equal-production-qualification","rot://decision/agentic-os/security-audit-surfaces-must-redact-raw-url-query-and-argv","rot://decision/agentic-os/security-gateways-remain-planners-until-executors-qualified","rot://decision/agentic-os/shared-behavior-corpus-does-not-hide-python-error-code-gap","rot://decision/agentic-os/survival-child-prs-prequalify-core-gates","rot://decision/agentic-os/survival-rejection-codes-are-first-class-cross-runtime-contract","rot://decision/agentic-os/survival-stacks-on-f1","rot://decision/agentic-os/t17-project-rust-upgrade-security-triggered","rot://decision/agentic-os/typescript-native-cyclonedx-deferred-without-pnpm-major-upgrade","rot://decision/agentic-os/typescript-workspace-installs-are-lockfile-frozen"],"event_watermark":0,"latest_checkpoint_id":"rot://checkpoint/agentic-os/cp16-post-integration-continuity-reconciliation-20260910","next_safe_actions":["configure and independently observe required exact-head checks plus pull-request/no-force-push/no-deletion/admin and signed-head enforcement through an authorized GitHub control-plane write path; promotion remains blocked until those controls are active","complete CP01/CP02/CP03 promotion governance without converting exact candidate locator knowledge into authority; preserve every unresolved compatibility, manifest, backend parity and independent-review obligation","accept the empirical zero-context successor death drill only from a genuinely fresh independent runtime/session and verify raw durable inputs, attestation, source revision, elapsed time, reconstructed state and verifier result","if canonical Survival moves beyond d19009055fb86e33836706fd0f09991869311431, refresh/rebuild downstream GGEV2 exact-source snapshots such as PR #18 before semantic integration; preserve compatible concurrent work","run the final whole-system exact-candidate adversarial gauntlet only after governance promotion, GitHub enforcement and empirical recovery hard gates close","qualify a simple single-host durable accepted-event writer only after all hard promotion gates pass; keep event watermark 0 until then"],"north_star":"Any authorized zero-context runtime can reconstruct the same bounded state, event horizon, ownership, evidence, graph context and next safe action without hidden chat memory.","observed_source_sha":"015abe49353f744269d10cec7f7d3778a46e963c","project_id":"rot://project/agentic-os","projection_hash":null,"schema_version":"2","unverified_capabilities":["rot://capability/durable-accepted-event-writer","rot://capability/empirical-zero-context-death-drill","rot://capability/multi-host-authority","rot://capability/network-executor","rot://capability/process-executor"],"verified_capabilities":["rot://capability/f1-cross-language-parity-ci@c52d395cff87fdb668aaf33eb2594ed68b45aea2","rot://capability/f1-rust-contract-kernel-ci@c52d395cff87fdb668aaf33eb2594ed68b45aea2","rot://capability/github-native-pr-merge-signature-path","rot://capability/pr2-semantic-supersession-audited","rot://capability/survival-v2-checkpoint-lineage-topology-v2","rot://capability/survival-v2-child-lane-core-premerge-gates","rot://capability/survival-v2-consumed-transition-replay-regression","rot://capability/survival-v2-continuity-ci@c52d395cff87fdb668aaf33eb2594ed68b45aea2","rot://capability/survival-v2-durable-store-property-union","rot://capability/survival-v2-empirical-drill-submission-schema@c52d395cff87fdb668aaf33eb2594ed68b45aea2","rot://capability/survival-v2-empirical-drill-verifier@c52d395cff87fdb668aaf33eb2594ed68b45aea2","rot://capability/survival-v2-external-governance-candidate-locators","rot://capability/survival-v2-frozen-pnpm-lock@93d62a4146e21eac1b04737564c253707d40c676d02bc19705d9996bf1d079aa","rot://capability/survival-v2-network-policy-planner-reference@6992478ada66339470e934052b740cba7db0f2b1","rot://capability/survival-v2-process-policy-planner-reference@6992478ada66339470e934052b740cba7db0f2b1","rot://capability/survival-v2-promotion-control-plane-readiness-observer","rot://capability/survival-v2-python-reference-contextpack","rot://capability/survival-v2-python-reference-coordination","rot://capability/survival-v2-python-reference-death-drill-simulator","rot://capability/survival-v2-python-reference-graph-rebuild","rot://capability/survival-v2-python-reference-state","rot://capability/survival-v2-python-reference-store-replay","rot://capability/survival-v2-python-shared-behavior-corpus","rot://capability/survival-v2-python-structured-error-code-contract@5952b4c792ef7ca6996f1ca82cd04b1b11bbb431","rot://capability/survival-v2-rust-operator-cli-readonly","rot://capability/survival-v2-rust-shared-behavior-corpus","rot://capability/survival-v2-t17-supply-chain-assurance","rot://capability/survival-v2-typescript-shared-behavior-corpus","rot://capability/survival-v2-untrusted-content-envelope-reference@6992478ada66339470e934052b740cba7db0f2b1"]}